id,title,description,availability,availability date,expiration date,link,image link,price,sale price,sale price effective date,identifier exists,gtin,mpn,brand,product highlight,product detail,additional image link,condition,adult,color,size,size type,size system,gender,material,pattern,age group,multipack,is bundle,unit pricing measure,unit pricing base measure,energy efficiency class,min energy efficiency class,min energy efficiency class,item group id,sell on google quantity
EKUK175453902,Nike Dunk Low Triple Pink – Women’s Size UK 4,"Brand new with original box, never worn. 100% authentic.",in_stock,,,,https://media-cdn.prabisha.com/uploads/ecokart/1754583823302-309245508.jpg,124.99 GBP,,,,,,Nike,,,,,,,,,,,,,,,,,,,,,,
EKUK593,Christmas Cookie Cutters – Set of 10 Festive Shapes,Get ready for holiday baking fun with this set of 10 cutters!,in_stock,,,,https://media-cdn.prabisha.com/uploads/ecokart/1754583823302-309245508.jpg,5.99 GBP,,,,,,Wilton,,,,,,,,,,,,,,,,,,,,,,
EKUK175458231,Squishmallows Fifi the Red Fox 8” Plush,Super Soft & Cuddly. Very Good Used Condition.,in_stock,,,,https://media-cdn.prabisha.com/uploads/ecokart/1754583823302-309245508.jpg,11.99 GBP,,,,,,Squishmallows,,,,,,,,,,,,,,,,,,,,,,
EKUK1754583540523679,Mini Squishmallows Set – 11 Plush Dolls (Small & Mini Sizes) – VGUC,Very Good Used Condition. 11 plush dolls (small & mini sizes).,in_stock,,,,https://media-cdn.prabisha.com/uploads/ecokart/1754583823302-309245508.jpg,15.99 GBP,,,,,,Squishmallows,,,,,,,,,,,,,,,,,,,,,,
EKUK175458231388027,Squishmallows Fifi the Red Fox 8” Plush – VGUC – Super Soft & Cuddly,Super Soft & Cuddly. Very Good Used Condition.,in_stock,,,,https://media-cdn.prabisha.com/uploads/ecokart/1754583433631-469798810.jpg,11.99 GBP,,,,,,Squishmallows,,,,,,,,,,,,,,,,,,,,,,
EKUK1754539021357220,Nike Dunk Low Triple Pink – Women’s Size UK 4 – DH9765-600 – Brand New with Box,"Brand new with original box, never worn. 100% authentic.",in_stock,,,,https://media-cdn.prabisha.com/uploads/ecokart/1754539220486-930781908.jpg,124.99 GBP,,,,,,Nike,,,,,,,,,,,,,,,,,,,,,,
EKUK1754503203961299,Marvel’s Spidey and His Amazing Friends – Spidey Transporter excellent condition,Excellent condition.,in_stock,,,,https://media-cdn.prabisha.com/uploads/ecokart/1754503458757-571050300.jpg,28.99 GBP,,,,,,Marvel / Spidey,,,,,,,,,,,,,,,,,,,,,,
EKUK1754502856331322,"LeapFrog Spin & Sing Alphabet Zoo – Toddler Learning Toy, Multicolor – NEW",Brand new in box. Toddler learning toy.,in_stock,,,,https://media-cdn.prabisha.com/uploads/ecokart/1754503064164-604140931.jpg,24.99 GBP,,,,,,LeapFrog,,,,,,,,,,,,,,,,,,,,,,
EKUK1754502698298837,VANS Chapman Stripe Leather Lace-Up Shoes – Maroon – UK 7.5 – NEW with Tag,New with tag. Maroon color. Leather lace-up.,in_stock,,,,https://media-cdn.prabisha.com/uploads/ecokart/1754502689743-75924720.jpg,49.99 GBP,,,,,,VANS,,,,,,,,,,,,,,,,,,,,,,
EKUK1754501880249109,Nike Air Jordan 1 Zoom Comfort High – Medium Grey – W UK 2.5 – NEW (No Tag),"New, without tag. Medium grey.",in_stock,,,,https://media-cdn.prabisha.com/uploads/ecokart/1754502231755-603235315.jpg,149.99 GBP,,,,,,Nike,,,,,,,,,,,,,,,,,,,,,,
EKUK1754315872048805,Umbro Men's Padded Training Anorak Jacket – Jester Red Vermillion – Size L – NEW,New with tag. Padded. Jester Red Vermillion. Size L.,in_stock,,,,https://media-cdn.prabisha.com/uploads/ecokart/1754316165966-728124449.jpg,62.99 GBP,,,,,,Umbro,,,,,,,,,,,,,,,,,,,,,,
EKUK1754315348096908,"Calvin Klein Men’s Black Poly Bonded Open Bottom Jacket, Size M, Excellent",Excellent condition. Black Poly Bonded Open Bottom Jacket. Size M.,in_stock,,,,https://media-cdn.prabisha.com/uploads/ecokart/1754315724945-257384285.jpg,52.49 GBP,,,,,,Calvin Klein,,,,,,,,,,,,,,,,,,,,,,
EKUK1754308585412624,Next Regular Fit Blue Jeans – Age 10 Years | Height 140cm | Waist 64cm – EUC,"Excellent Used Condition. For Age 10, Height 140cm, Waist 64cm.",in_stock,,,,https://media-cdn.prabisha.com/uploads/ecokart/1754309078679-82261288.jpg,13.99 GBP,,,,,,Next,,,,,,,,,,,,,,,,,,,,,,
EKUK1754301861992623,Adidas x Farm Jardinette Firebird Track Jacket – Size UK 10 Excellent condition,Excellent condition. Size UK 10.,in_stock,,,,https://media-cdn.prabisha.com/uploads/ecokart/1754302340698-219776124.jpg,52.49 GBP,,,,,,Adidas x Farm,,,,,,,,,,,,,,,,,,,,,,
EKUK1754301520533306,"Arlec Spencer Desk Lamp Black Warm White Light | 4W Integrated LED, Black | VGUC",Very Good Used Condition. Black. 4W Integrated LED (Warm White Light).,in_stock,,,,https://media-cdn.prabisha.com/uploads/ecokart/1754301642968-855916297.jpg,31.99 GBP,,,,,,Arlec,,,,,,,,,,,,,,,,,,,,,,
EKUK1754296344092603,Theo Klein Braun Mega Hairstyling Case – Toy Beauty Set – VGUC,Very Good Used Condition. Toy Beauty Set.,in_stock,,,,https://media-cdn.prabisha.com/uploads/ecokart/1754296560646-36520999.jpg,15.99 GBP,,,,,,Theo Klein Braun,,,,,,,,,,,,,,,,,,,,,,
EKUK1754295936993512,John Lewis Varsity Shower-Resistant Bomber Jacket – NEW with Tag,New with tag. Shower-resistant. Varsity style.,in_stock,,,,https://media-cdn.prabisha.com/uploads/ecokart/1754296189041-644971517.jpg,26.49 GBP,,,,,,John Lewis,,,,,,,,,,,,,,,,,,,,,,
EKUK1754292913103577,HEXBUG VEX Robotics Rover & Fuel Truck Explorer STEM Starter Kit Brand New Boxed,Brand new. STEM Starter Kit including Rover & Fuel Truck.,in_stock,,,,https://media-cdn.prabisha.com/uploads/ecokart/1754293143966-993077181.jpg,21.49 GBP,,,,,,HEXBUG,,,,,,,,,,,,,,,,,,,,,,